{
  "image": "fig3_data_mockup.png",
  "version": 1,
  "type": "data_mockup",
  "backend": "ai",
  "checks": {
    "prompt_fidelity": true,
    "readability": true,
    "focal_clarity": true,
    "design_taboos_avoided": true,
    "print_friendly": false,
    "cross_figure_consistency": true
  },
  "score": "5/6",
  "verdict": "pass",
  "suggestions": [
    "Add distinct marker shapes (e.g. circle vs triangle) or hatching to distinguish LOH vs non-LOH groups for colorblind / B&W print friendliness"
  ],
  "checked_at": "2026-05-10T01:25:00Z"
}
